<?xml version="1.0" encoding="UTF-8"?>
<manifest xmlns:xsi="http://www.w3.org/2001/XMLSchema-instance"
          xsi:noNamespaceSchemaLocation="../../../../../../App/Manifest/Schema/manifest-1.0.xsd">
    <meta>
        <name>test</name>
        <label>Swag App Test</label>
        <label lang="de-DE">Swag App Test</label>
        <description>Test for App System</description>
        <description lang="de-DE">Test f√ºr das App System</description>
        <author>shopware AG</author>
        <copyright>(c) by shopware AG</copyright>
        <version>1.0.0</version>
        <license>MIT</license>
    </meta>
    <setup>
        <registrationUrl>https://my.app.com/fixedOrderManifest/registration</registrationUrl>
        <secret>s3cr3t</secret>
    </setup>
</manifest>
