<?xml version="1.0" encoding="UTF-8"?>
<manifest xmlns:xsi="http://www.w3.org/2001/XMLSchema-instance"
          xsi:noNamespaceSchemaLocation="https://raw.githubusercontent.com/shopware/platform/master/src/Core/Framework/App/Manifest/Schema/manifest-1.0.xsd">
    <meta>
        <name>SwagApp</name>
        <label>Swag App Test</label>
        <label lang="de-DE">Swag App Test</label>
        <description>Test for App System</description>
        <description lang="de-DE">Test f√ºr das App System</description>
        <author>shopware AG</author>
        <copyright>(c) by shopware AG</copyright>
        <version>1.0.0</version>
        <icon>icon.png</icon>
        <license>MIT</license>
    </meta>
    <setup>
        <registrationUrl>https://my.app.com/SwagApp/registration</registrationUrl>
        <secret>s3cr3t</secret>
    </setup>
    <custom-fields>
        <custom-field-set>
            <name>custom_field_test</name>
            <label>Custom field test</label>
            <label lang="de-DE">Zusatzfeld Test</label>
            <related-entities>
                <product/>
                <customer/>
            </related-entities>
            <fields>
                <datetime name="test_datetime_field">
                    <label>Test datetime field</label>
                </datetime>
            </fields>
        </custom-field-set>
    </custom-fields>
</manifest>
