<?xml version="1.0" encoding="UTF-8"?>
<manifest xmlns:xsi="http://www.w3.org/2001/XMLSchema-instance"
          xsi:noNamespaceSchemaLocation="https://raw.githubusercontent.com/shopware/platform/trunk/src/Core/Framework/App/Manifest/Schema/manifest-1.0.xsd">
    <meta>
        <name>registrationFailure</name>
        <label>Swag App Test</label>
        <label lang="de-DE">Swag App Test</label>
        <description>Test for App System</description>
        <description lang="de-DE">Test f√ºr das App System</description>
        <author>shopware AG</author>
        <copyright>(c) by shopware AG</copyright>
        <version>1.0.0</version>
        <icon>icon.png</icon>
        <license>MIT</license>
    </meta>
    <setup>
        <registrationUrl>https://my.app.com/wrongurl/registration</registrationUrl>
        <secret>s3cr3t</secret>
    </setup>
    <admin>
        <action-button
            action="viewOrder"
            entity="order"
            view="detail"
            url="https://swag-test.com/your-order"
            openNewTab="true">
            <label>View Order</label>
            <label lang="de-DE">Zeige Bestellung</label>
        </action-button>
        <action-button
            action="doStuffWithProducts"
            entity="product"
            view="list"
            url="https://swag-test.com/do-stuff">
            <label>Do Stuff</label>
            <label lang="de-DE">Mache Dinge</label>
        </action-button>
    </admin>
</manifest>
