<?xml version="1.0" encoding="UTF-8"?>
<manifest xmlns:xsi="http://www.w3.org/2001/XMLSchema-instance"
          xsi:noNamespaceSchemaLocation="../../../../../../src/Core/Content/App/Manifest/Schema/manifest-1.0.xsd">
    <meta>
        <name>SwagApp</name>
        <label>Swag App Test</label>
        <label lang="de-DE">Swag App Test</label>
        <description>Test for App System</description>
        <description lang="de-DE">Test f√ºr das App System</description>
        <author>shopware AG</author>
        <copyright>(c) by shopware AG</copyright>
        <version>1.0.0</version>
        <icon>icon.png</icon>
        <license>MIT</license>
    </meta>
    <setup>
        <registrationUrl>https://my.app.com/SwagApp/registration</registrationUrl>
        <secret>s3cr3t</secret>
    </setup>
    <admin>
        <action-button
            action="viewOrder"
            entity="order"
            view="detail"
            url="https://swag-test.com/your-order"
            openNewTab="true">
            <label>View Order</label>
            <label lang="de-DE">Zeige Bestellung</label>
        </action-button>
        <action-button
            action="doStuffWithProducts"
            entity="product"
            view="list"
            url="https://swag-test.com/do-stuff">
            <label>Do Stuff</label>
        </action-button>
        <module name="first-module" source="https://test.com">
            <label>My first own module</label>
            <label lang="de-DE">Mein erstes eigenes Modul</label>
        </module>
    </admin>
    <permissions>
        <create>product</create>
        <update>product</update>
        <delete>product</delete>
        <delete>category</delete>
        <create>product_manufacturer</create>
        <delete>product_manufacturer</delete>
        <create>tax</create>
    </permissions>
    <custom-fields>
        <custom-field-set>
            <name>custom_field_test</name>
            <label>Custom field test</label>
            <label lang="de-DE">Zusatzfeld Test</label>
            <related-entities>
                <product/>
                <customer/>
            </related-entities>
            <fields/>
        </custom-field-set>
    </custom-fields>
    <webhooks>
        <webhook name="hook1" url="https://test.com/hook" event="checkout.customer.before.login"/>
        <webhook name="hook2" url="https://test.com/hook2" event="checkout.order.placed"/>
    </webhooks>
</manifest>
